{
  "$schema": "https://json-schema.org/draft/2020-12/schema",
  "$id": "https://fomo-kernel.local/schemas/price-feed.schema.json",
  "title": "Fomo Kernel Agent-Supplied Price Feed",
  "description": "Closing prices, an FX rate, or both, transcribed from a recognized market-data source when the host cannot retrieve them itself. Declared facts only: the agent never computes a return, a weight, or a P&L number. Every close and history entry is a RAW market observation as printed on its own session date; never send a split-adjusted price. The engine rebases each observation onto the split basis of the share count it will be multiplied by, using that row's date against the declared splits. `prices` and `fx` are each optional (#642) -- a host that can read one public FX rate but not every instrument's close may supply `fx` alone, which is what makes a book refused only for a missing rate on a currency its account aggregate spans (#612, and #649 for a currency that only a cash-flow row carries) repairable without fabricating closes nobody asked for -- but the envelope must declare at least one of the two; see `anyOf` below.",
  "type": "object",
  "additionalProperties": false,
  "required": ["as_of", "source"],
  "anyOf": [
    {"required": ["prices"], "properties": {"prices": {"minItems": 1}}},
    {"required": ["fx"], "properties": {"fx": {"minItems": 1}}}
  ],
  "properties": {
    "schema_version": {
      "const": 1
    },
    "as_of": {
      "type": "string",
      "pattern": "^[0-9]{4}-[0-9]{2}-[0-9]{2}$",
      "description": "Non-future end-of-day date this feed represents; no row may be dated after it."
    },
    "source": {
      "type": "string",
      "minLength": 1,
      "description": "Feed-level provenance, named on the card. Use the market-data source, not a search engine."
    },
    "prices": {
      "type": "array",
      "maxItems": 500,
      "description": "One row per priced instrument. Optional when `fx` is supplied and non-empty (#642): omit it entirely, or send an empty list, for a rate-only repair. See the top-level `anyOf` -- an envelope needs at least one of `prices` or `fx`.",
      "items": {
        "type": "object",
        "additionalProperties": false,
        "required": ["ticker", "close", "date", "currency"],
        "properties": {
          "ticker": {
            "type": "string",
            "pattern": "^[A-Za-z0-9^][A-Za-z0-9.\\-^=]{0,19}$",
            "description": "The complete engine symbol (for example NVDA, 2330.TW, ^TWII). Canonicalized on the way in through engine/symbols.py, the same rule the book's own identities use (#803), so a close published for `nvda` prices the NVDA the holdings and the premise both name."
          },
          "close": {
            "type": "number",
            "exclusiveMinimum": 0,
            "description": "Raw closing price as printed on `date`, in the instrument's own trading currency. Do not adjust it for a split yourself: state the observation and declare the split in `splits`, and the engine rebases it onto the share count's basis."
          },
          "date": {
            "type": "string",
            "pattern": "^[0-9]{4}-[0-9]{2}-[0-9]{2}$",
            "description": "Session date of this close, and therefore the split basis it is observed in."
          },
          "currency": {
            "type": "string",
            "pattern": "^[A-Z]{3}$",
            "description": "Trading currency of the close. A currency contradicting the trade rows fails the run closed."
          },
          "source": {
            "type": "string",
            "minLength": 1,
            "description": "Per-instrument source when it differs from the feed-level source."
          },
          "history": {
            "type": "array",
            "maxItems": 2000,
            "description": "Optional daily close series of raw observations, each as printed on its own date. Unlocks benchmark comparison, beta and alpha, the P&L curve, and account-level time-weighted return. The engine rebases a series that spans a declared split before any of those consumers difference it, so the split is not read as a market move.",
            "items": {
              "oneOf": [
                {
                  "type": "array",
                  "minItems": 2,
                  "maxItems": 2,
                  "prefixItems": [
                    {"type": "string", "pattern": "^[0-9]{4}-[0-9]{2}-[0-9]{2}$"},
                    {"type": "number", "exclusiveMinimum": 0}
                  ]
                },
                {
                  "type": "object",
                  "additionalProperties": false,
                  "required": ["date", "close"],
                  "properties": {
                    "date": {"type": "string", "pattern": "^[0-9]{4}-[0-9]{2}-[0-9]{2}$"},
                    "close": {"type": "number", "exclusiveMinimum": 0}
                  }
                }
              ]
            }
          },
          "splits": {
            "type": "array",
            "maxItems": 2000,
            "description": "Optional split events the source shows, as [date, ratio] (a 10-for-1 split is 10). Omitted means no adjustment is applied, which is not cosmetic, on either side of the multiplication. The ledger records each trade at the share count that actually executed, so a sale after an undeclared split is subtracted from pre-split buys and a routine trim reads as a full exit (#550); and the close above is the basis its own session printed, so an undeclared split leaves a pre-split price valuing a post-split share count — a tenfold market value, weight and concentration verdict (#583). When a split falls between a close's date and the day this book is read, `consider` refuses rather than guessing which side is wrong.",
            "items": {
              "oneOf": [
                {
                  "type": "array",
                  "minItems": 2,
                  "maxItems": 2,
                  "prefixItems": [
                    {"type": "string", "pattern": "^[0-9]{4}-[0-9]{2}-[0-9]{2}$"},
                    {"type": "number", "exclusiveMinimum": 0}
                  ]
                },
                {
                  "type": "object",
                  "additionalProperties": false,
                  "required": ["date", "ratio"],
                  "properties": {
                    "date": {"type": "string", "pattern": "^[0-9]{4}-[0-9]{2}-[0-9]{2}$"},
                    "ratio": {"type": "number", "exclusiveMinimum": 0}
                  }
                }
              ]
            }
          }
        }
      }
    },
    "fx": {
      "type": "array",
      "description": "Spot rates for a mixed-currency portfolio. Omit an unavailable rate instead of guessing it. May be supplied with `prices` omitted or empty (#642) -- a rate-only envelope is a complete repair for a book refused only for a missing held-currency rate.",
      "items": {
        "type": "object",
        "additionalProperties": false,
        "required": ["currency", "usd_per_unit", "date"],
        "properties": {
          "currency": {
            "type": "string",
            "pattern": "^[A-Z]{3}$",
            "description": "Non-USD currency code; USD is fixed at 1.0 and must not be supplied."
          },
          "usd_per_unit": {
            "type": "number",
            "exclusiveMinimum": 0,
            "description": "USD per one unit of this currency."
          },
          "date": {"type": "string", "pattern": "^[0-9]{4}-[0-9]{2}-[0-9]{2}$"},
          "source": {"type": "string", "minLength": 1}
        }
      }
    }
  }
}
